{
  "schema_version": 1,
  "current_attempt_id": "11111111-1111-4111-8111-111111111111",
  "seed_sha256": "aaaaaaaaaaaaaaaaaaaaaaaaaaaaaaaaaaaaaaaaaaaaaaaaaaaaaaaaaaaaaaaa",
  "lineage_validation_sha256": "bbbbbbbbbbbbbbbbbbbbbbbbbbbbbbbbbbbbbbbbbbbbbbbbbbbbbbbbbbbbbbbb",
  "primary_sources": [],
  "fix_sources": [],
  "next_fix_sequence": 1
}
